,价格,面积,编号,户型,楼层,位置1,位置2,小区,地铁
1554,2960,16,1328-B,4室1卫,6/18层,朝阳区,肖村,中海城圣朝菲,地铁：距亦庄线肖村站600米
1555,9660,113,151113-A,2室1卫,11/26层,朝阳区,十里河,嘉多丽园,"地铁：距10号线,14号线东段,17号线十里河站250米"
1556,3420,21,157448-B,3室1卫,16/20层,昌平区,天通苑,天通苑西二区,地铁：距5号线天通苑站500米
1557,2000,11,17386-A,4室1卫,8/28层,大兴区,生物医药基地,住总正华多彩嘉园,地铁：距4号线大兴线生物医药基地站400米
1558,2260,9,17641-B,2室1卫,4/16层,顺义区,花梨坎,枫泉花园,地铁：距15号线花梨坎站700米
1559,2830,13,2140-C,3室1卫,8/18层,昌平区,回龙观东大街,紫金新干线四期,地铁：距8号线回龙观东大街站1400米
1560,2590,13,2149-A,3室1卫,12/17层,丰台区,新宫,德鑫嘉园三期,"地铁：距4号线大兴线,19号线新宫站850米"
1561,2340,10,19266-B,3室1卫,16/21层,丰台区,樊羊路,花香东苑,地铁：距房山线樊羊路站450米
1562,2220,11,22438-C,3室1卫,5/6层,通州区,通州北苑,新华西街131号院,地铁：距八通线通州北苑站400米
1563,1840,10,23830-A,4室1卫,4/17层,通州区,经海路,首开国风美仑,地铁：距亦庄线经海路站2550米
1564,3130,18,264-A,3室1卫,19/25层,丰台区,方庄,芳城园一区,地铁：距14号线东段方庄站550米
1565,1510,20,24639-A,3室1卫,4/7层,房山区,良乡大学城西,伟业嘉园西里,地铁：距房山线良乡大学城西站1050米
1566,1470,8,25289-A,4室1卫,11/20层,门头沟区,小园,保利首开四季怡园,地铁：距S1线小园站950米
1567,2550,14,2555-B,3室1卫,2/6层,朝阳区,黄渠,常营民族家园CDF区,地铁：距6号线黄渠站750米
1568,2600,11,2546-C,3室1卫,5/20层,朝阳区,双桥,金隅康惠园,地铁：距八通线双桥站600米
1569,1960,10,28815-A,4室1卫,5/20层,通州区,物资学院路,新地国际家园,地铁：距6号线物资学院路站3000米
1570,2950,12,2853-A,3室1卫,4/18层,朝阳区,星火,姚家园东里7号院,"地铁：距3号线,20号线星火站800米"
1571,2020,7,31704-A,3室1卫,6/6层,丰台区,科怡路,富丰路8号院,地铁：距9号线科怡路站1500米
1572,2000,7,32225-B,3室1卫,28/28层,朝阳区,小红门,鸿博家园二期D区,地铁：距亦庄线小红门站450米
1573,2160,10,33538-C,3室1卫,11/16层,朝阳区,管庄,管庄新村,地铁：距八通线管庄站600米
1574,1540,12,44070-A,4室1卫,3/11层,通州区,通州北关,刘庄新村,地铁：距6号线通州北关站2700米
1575,1510,11,51671-D,4室1卫,4/6层,房山区,良乡大学城西,鸿顺园西区,地铁：距房山线良乡大学城西站350米
1576,1890,10,55043-C,3室1卫,9/26层,通州区,高楼金,高楼金第,地铁：距7号线高楼金站250米
1577,1650,12,56105-C,3室1卫,5/6层,通州区,通运门,新潮嘉园二期,地铁：距6号线通运门站4150米
1578,1510,10,61926-C,3室1卫,6/11层,房山区,稻田,高四回迁楼,地铁：距房山线稻田站800米
1579,1870,12,65708-A,3室1卫,16/18层,房山区,稻田,稻田回迁楼,地铁：距房山线稻田站250米
1580,3220,14,6645-B,3室1卫,1/7层,朝阳区,望京,望京西园一区,"地铁：距14号线东段,15号线望京站850米"
1581,3210,11,72795-B,2室1卫,2/6层,丰台区,六里桥东,太平桥小区,地铁：距9号线六里桥东站400米
1582,2890,13,822-B,3室1卫,7/7层,丰台区,宋家庄,政馨园三区,"地铁：距5号线,10号线,亦庄线宋家庄站300米"
1583,2450,18,125156-B,4室1卫,16/21层,丰台区,樊羊路,天伦锦城,地铁：距房山线樊羊路站1700米
1584,4670,18,129153-B,2室1卫,5/6层,海淀区,魏公村,大慧寺6号院,地铁：距4号线大兴线魏公村站800米
1585,2300,15,136781-A,3室1卫,1/6层,昌平区,天通苑东,天通苑东二区,地铁：距17号线天通苑东站650米
1586,2550,11,142955-A,4室1卫,10/29层,朝阳区,管庄,北京新天地,地铁：距八通线管庄站750米
1587,4270,19,143207-A,2室1卫,13/13层,西城区,积水潭,文慧园北路甲26号,"地铁：距2号线,19号线积水潭站900米"
1588,3060,16,144937-C,4室2卫,11/11层,朝阳区,南楼梓庄,紫南家园（北区）,地铁：距7号线南楼梓庄站300米
1589,2420,10,13095-C,3室1卫,1/19层,朝阳区,星火,姚家园东里8号院,"地铁：距3号线,20号线星火站800米"
1590,2740,8,147328-B,2室1卫,4/25层,石景山区,金安桥,金铸阳光苑,"地铁：距6号线,S1线金安桥站500米"
1591,2190,25,150821-C,3室1卫,1/6层,大兴区,黄村西大街,黄村西里,地铁：距4号线大兴线黄村西大街站500米
1592,2740,9,13642-A,3室1卫,28/29层,丰台区,宋家庄,鲁能榴景秀苑,"地铁：距5号线,10号线,亦庄线宋家庄站550米"
1593,2750,10,15740-B,4室1卫,5/10层,海淀区,田村,乐府江南,地铁：距6号线海淀五路居站1300米
1594,2120,11,17337-B,3室1卫,2/28层,大兴区,生物医药基地,住总正华多彩嘉园,地铁：距4号线大兴线生物医药基地站400米
1595,4030,9,17628-B,2室1卫,5/5层,海淀区,五道口,中关村三才堂,地铁：距13号线五道口站600米
1596,2880,18,15789-A,3室1卫,22/22层,朝阳区,双合,建工双合家园,地铁：距7号线双合站350米
1597,2370,8,2140-B,3室1卫,8/18层,昌平区,回龙观东大街,紫金新干线四期,地铁：距8号线回龙观东大街站1400米
1598,1620,11,21905-D,4室1卫,3/18层,顺义区,顺义,石园北区,地铁：距15号线顺义站1950米
1599,3280,10,23881-B,4室1卫,6/25层,朝阳区,呼家楼,向军南里,"地铁：距6号线,10号线呼家楼站250米"
1600,2420,17,28988-B,2室1卫,5/5层,顺义区,顺义,建新北区,地铁：距15号线顺义站700米
1601,2130,10,2879-A,3室1卫,16/28层,通州区,物资学院路,新建村小区,地铁：距6号线物资学院路站550米
1602,3660,18,29048-B,4室1卫,9/11层,丰台区,首经贸,万年花城二期,"地铁：距10号线,房山线首经贸站350米"
1603,2440,13,30156-B,4室1卫,10/12层,朝阳区,小红门,燕归宁馨园,地铁：距亦庄线小红门站1200米
1604,1110,7,32303-A,5室1卫,3/19层,房山区,广阳城,北京城建国誉府,地铁：距房山线广阳城站1200米
1605,3280,23,3290-D,4室1卫,4/18层,朝阳区,北工大西门,双龙南里,地铁：距14号线东段北工大西门站450米
1606,1860,15,33166-C,4室1卫,2/8层,房山区,良乡大学城北,金地朗悦悦园,地铁：距房山线良乡大学城北站950米
1607,1690,9,27838-D,4室1卫,2/15层,朝阳区,东坝中街,金驹家园,地铁：距6号线褡裢坡站4200米
1608,1320,8,39386-A,6室2卫,6/6层,顺义区,石门,澜西园,地铁：距15号线石门站2200米
1609,2740,14,39487-B,4室1卫,14/15层,大兴区,万源街,鹿鸣苑,地铁：距亦庄线万源街站550米
1610,2140,11,38079-A,3室1卫,2/5层,大兴区,高米店北,郁花园二里,地铁：距4号线大兴线高米店北站200米
1611,3840,48,41743-A,1室1卫,18/21层,丰台区,张郭庄,红山郡,地铁：距14号线西段张郭庄站1750米
1612,1320,14,42154-A,3室1卫,15/18层,房山区,阎村,天恒乐活城,地铁：距燕房线阎村站200米
1613,2240,15,50842-D,5室1卫,4/6层,大兴区,枣园,那尔水晶城,地铁：距4号线大兴线枣园站650米
1614,3240,21,52034-A,2室1卫,5/16层,石景山区,古城,古城南里,地铁：距1号线古城站100米
1615,1960,6,5302-B,3室1卫,20/23层,朝阳区,双桥,金隅康惠园,地铁：距八通线双桥站600米
1616,2530,9,55447-A,3室1卫,2/6层,丰台区,北京南站,马家堡路8号院,"地铁：距4号线大兴线,14号线东段北京南站站600米"
1617,1880,10,57791-C,3室1卫,1/6层,顺义区,花梨坎,三山新新家园,地铁：距15号线花梨坎站2100米
1618,1900,8,58465-A,2室1卫,3/7层,通州区,梨园,公庄小区,地铁：距八通线梨园站1200米
1619,3980,19,59349-A,2室1卫,14/14层,朝阳区,金台路,延静西里,"地铁：距6号线,14号线东段金台路站450米"
1620,2840,11,69671-C,3室1卫,2/27层,朝阳区,常营,北辰福第中区,地铁：距6号线常营站450米
1621,1530,8,61593-B,4室1卫,11/15层,房山区,长阳,馨然嘉园三区,地铁：距房山线长阳站1000米
1622,2830,17,70170-B,3室1卫,4/6层,石景山区,八角游乐园,老山西里,地铁：距1号线八角游乐园站500米
1623,4840,48,8087-A,1室1卫,6/23层,朝阳区,草房,北京像素,地铁：距6号线草房站300米
1624,2700,8,80776-B,3室1卫,4/22层,朝阳区,东风北桥,驼房营南里,"地铁：距14号线东段,平谷线东风北桥站1450米"
1625,3110,11,9386-B,3室1卫,8/25层,朝阳区,阜通,方舟苑,地铁：距14号线东段阜通站1500米
1626,3700,17,9386-C,3室1卫,8/25层,朝阳区,阜通,方舟苑,地铁：距14号线东段阜通站1500米
1627,2830,16,118883-B,3室1卫,5/7层,朝阳区,成寿寺,嘉和人家,地铁：距10号线成寿寺站750米
1628,1340,11,119110-C,3室1卫,3/10层,房山区,良乡大学城,东羊庄新村,地铁：距房山线良乡大学城站1200米
1629,3620,16,121336-A,2室1卫,12/25层,丰台区,蒲黄榆,芳古园一区,"地铁：距5号线,14号线东段蒲黄榆站350米"
1630,3080,16,124860-B,2室1卫,8/12层,石景山区,八角游乐园,久筑物业,地铁：距1号线玉泉路站2600米
1631,2760,12,11207-B,3室1卫,25/28层,通州区,物资学院路,新建村小区,地铁：距6号线物资学院路站550米
1632,3140,9,130344-A,3室1卫,7/8层,海淀区,西二旗,燕尚园,"地铁：距13号线,昌平线西二旗站750米"
1633,3250,19,11937-B,3室1卫,4/6层,朝阳区,星火,姚家园西里3号院,"地铁：距3号线,20号线星火站350米"
1634,4300,20,135510-A,2室1卫,2/6层,朝阳区,安立路,慧忠里,地铁：距15号线安立路站700米
1635,2990,21,140653-A,2室1卫,1/6层,丰台区,科怡路,保温段住宅小区,地铁：距9号线科怡路站1550米
1636,2240,15,143679-A,3室1卫,9/12层,通州区,土桥,金隅花石匠,地铁：距八通线土桥站1100米
1637,2890,20,12973-D,5室1卫,3/9层,顺义区,国展,翠竹新村,地铁：距15号线国展站1800米
1638,2820,10,145752-B,2室1卫,6/12层,通州区,物资学院路,新建村小区,地铁：距6号线物资学院路站550米
1639,3220,11,146202-A,2室1卫,4/6层,朝阳区,劲松,劲松七区,地铁：距10号线劲松站1150米
1640,6900,97,146720-A,2室1卫,1/6层,丰台区,大红门,建欣苑三里,"地铁：距8号线南段,10号线大红门站500米"
1641,2460,9,147639-B,3室1卫,14/24层,丰台区,科怡路,南极星,地铁：距9号线科怡路站650米
1642,2630,11,147585-B,3室1卫,25/27层,石景山区,古城,长安家园,地铁：距1号线古城站300米
1643,3550,18,147604-B,2室1卫,3/6层,丰台区,马家堡,翠林二里,地铁：距4号线大兴线马家堡站750米
1644,2330,8,154675-B,3室1卫,3/6层,昌平区,回龙观东大街,霍营小区,地铁：距8号线回龙观东大街站850米
1645,2470,10,14761-B,3室1卫,13/27层,朝阳区,褡裢坡,泰福苑二区,地铁：距6号线褡裢坡站700米
1646,2440,13,16397-C,3室1卫,3/16层,丰台区,新宫,公园懿府,"地铁：距4号线大兴线,19号线新宫站2400米"
1647,2890,17,21324-A,2室1卫,2/6层,朝阳区,常营,连心园西区,地铁：距6号线常营站800米
1648,2440,13,20032-A,3室1卫,2/24层,丰台区,樊羊路,花香东苑,地铁：距房山线樊羊路站450米
1649,2740,8,263-E,6室2卫,1/6层,朝阳区,惠新西街北口,惠新西街小区,地铁：距5号线惠新西街北口站350米
1650,2470,9,2264-B,4室1卫,18/18层,昌平区,回龙观东大街,紫金新干线四期,地铁：距8号线回龙观东大街站1400米
1651,1750,11,21215-A,5室1卫,2/13层,顺义区,南法信,焦各庄街2号院,地铁：距15号线南法信站950米
1652,2410,13,35370-B,3室1卫,17/19层,昌平区,朱辛庄,TBD万科天地,"地铁：距昌平线,8号线朱辛庄站200米"
1653,2230,17,35737-B,2室1卫,4/6层,顺义区,顺义,石园西区,地铁：距15号线顺义站2300米
1654,2460,10,35116-B,3室1卫,13/15层,海淀区,永丰,友谊嘉园三期,地铁：距16号线永丰站2150米
1655,2520,17,3557-D,6室2卫,6/6层,朝阳区,星火,姚家园西里5号院,"地铁：距3号线,20号线星火站600米"
1656,2020,8,37781-B,3室1卫,8/25层,大兴区,亦庄桥,南海雅苑北区,地铁：距亦庄线荣京东街站2850米
1657,2700,17,42665-B,2室1卫,4/4层,昌平区,龙泽,二拨子新村东区,地铁：距13号线龙泽站1750米
1658,2670,11,43520-C,3室1卫,13/26层,丰台区,方庄,芳城园一区,地铁：距14号线东段方庄站550米
1659,3020,18,48376-B,4室1卫,7/27层,丰台区,方庄,芳城园一区,地铁：距14号线东段方庄站550米
1660,2160,14,48147-D,4室1卫,1/6层,大兴区,万源街,小康家园,地铁：距亦庄线万源街站2350米
1661,2570,14,51256-C,3室1卫,1/16层,丰台区,新宫,德鑫嘉园二期,"地铁：距4号线大兴线,19号线新宫站700米"
1662,3350,7,59276-D,4室1卫,3/34层,朝阳区,大望路,阳光100,"地铁：距1号线,14号线东段大望路站400米"
1663,2690,11,61310-B,3室1卫,16/22层,朝阳区,青年路,丽景馨居,地铁：距6号线青年路站800米
1664,1580,10,64212-A,3室1卫,4/6层,通州区,北运河西,玉桥东路30号院,地铁：距6号线北运河西站950米
1665,3290,20,70760-A,2室1卫,4/6层,朝阳区,立水桥,立水桥甲2号地质大院,"地铁：距13号线,5号线立水桥站600米"
1666,1650,16,73788-C,3室1卫,2/14层,房山区,篱笆房,加州水郡三期,地铁：距房山线篱笆房站2200米
1667,3140,13,74804-B,4室1卫,9/21层,朝阳区,红庙,延静里中街,"地铁：距6号线,14号线东段金台路站800米"
1668,1640,8,77732-D,4室1卫,8/11层,通州区,通运门,京贸家园,地铁：距6号线通运门站2650米
1669,2540,16,79830-A,2室1卫,4/6层,石景山区,金安桥,模式口西里,"地铁：距1号线,6号线苹果园站2200米"
1670,2630,12,9179-A,3室1卫,14/22层,朝阳区,褡裢坡,定福家园北里,地铁：距6号线褡裢坡站200米
1671,2430,6,117355-C,3室1卫,3/6层,海淀区,海淀五路居,永金里小区,地铁：距6号线海淀五路居站1300米
1672,4350,19,10652-C,3室1卫,5/33层,朝阳区,四惠,东恒时代一期,"地铁：距1号线,八通线四惠站150米"
1673,2780,16,125053-A,4室1卫,5/6层,海淀区,田村,玉海园三里,地铁：距6号线田村站1200米
1674,2540,12,11131-C,3室1卫,5/5层,朝阳区,黄渠,常营民族家园CDF区,地铁：距6号线黄渠站750米
1675,2860,8,129023-C,3室1卫,3/6层,海淀区,五棵松,永定路西里,地铁：距1号线玉泉路站900米
1676,3210,15,133960-D,4室1卫,3/6层,朝阳区,高碑店,兴隆家园,地铁：距八通线高碑店站600米
1677,2730,17,140177-B,3室1卫,3/6层,丰台区,丰台东大街,北大地三里,地铁：距9号线丰台东大街站1000米
1678,2400,9,144697-C,3室1卫,3/25层,朝阳区,焦化厂,燕保祈东家园二期,地铁：距7号线焦化厂站400米
1679,3500,15,146202-B,2室1卫,4/6层,朝阳区,劲松,劲松七区,地铁：距10号线劲松站1150米
1680,2640,12,13721-C,4室1卫,4/6层,昌平区,回龙观,金榜园,地铁：距13号线回龙观站1200米
1681,2050,12,154414-C,3室0卫,5/8层,通州区,梨园,柳岸方园,地铁：距八通线梨园站950米
1682,3110,15,18204-B,3室1卫,6/18层,朝阳区,化工,官悦欣园B区,地铁：距7号线化工站700米
1683,2570,23,19604-D,4室1卫,6/16层,顺义区,顺义,石园南区,地铁：距15号线顺义站2600米
1684,2980,12,22836-C,3室1卫,4/6层,朝阳区,星火,姚家园西里5号院,"地铁：距3号线,20号线星火站600米"
1685,3630,16,23312-A,3室1卫,4/6层,朝阳区,望京,南湖中园小区,"地铁：距14号线东段,15号线望京站700米"
1686,2400,14,24013-C,4室1卫,3/15层,朝阳区,东坝中街,金驹家园,地铁：距6号线褡裢坡站4200米
1687,2990,16,17969-B,3室1卫,2/6层,朝阳区,立水桥南,佳运园一期,"地铁：距13号线,5号线立水桥站1250米"
1688,2200,18,29168-A,3室1卫,2/6层,通州区,通州北关,东潞苑,地铁：距6号线通州北关站2350米
1689,1960,11,30392-B,3室1卫,18/22层,通州区,万盛西,大方居,地铁：距7号线万盛西站1350米
1690,2590,8,28123-C,4室1卫,12/28层,昌平区,龙泽,回龙观新村东区,"地铁：距13号线,昌平线西二旗站1250米"
1691,1890,12,33781-C,3室1卫,5/19层,通州区,物资学院路,金地格林格林,地铁：距6号线物资学院路站2950米
1692,2490,13,3120-B,3室1卫,1/8层,朝阳区,孙河,康营小区,地铁：距15号线孙河站1000米
1693,2560,11,37976-B,2室1卫,4/5层,朝阳区,褡裢坡,定福庄北里2号院,地铁：距6号线褡裢坡站750米
1694,3200,15,388-A,3室1卫,23/30层,昌平区,龙泽,融泽嘉园2号院,"地铁：距13号线,昌平线西二旗站1750米"
1695,2900,13,39324-B,3室1卫,21/26层,朝阳区,常营,保利嘉园3号院,地铁：距6号线常营站800米
1696,2400,9,40510-A,3室1卫,1/6层,朝阳区,褡裢坡,三间房西里,地铁：距6号线褡裢坡站800米
1697,2350,12,44810-B,2室1卫,1/15层,顺义区,花梨坎,枫泉花园,地铁：距15号线花梨坎站700米
1698,3180,23,4233-A,3室1卫,5/5层,朝阳区,黄渠,常营民族家园B区,地铁：距6号线黄渠站800米
1699,1980,10,46784-B,3室1卫,4/6层,大兴区,旧宫,清欣园甲区,地铁：距亦庄线旧宫站1600米
1700,2470,9,48143-A,3室1卫,18/20层,朝阳区,褡裢坡,福盈家园3号院,地铁：距6号线褡裢坡站450米
1701,1710,13,47765-A,2室1卫,5/6层,昌平区,昌平,鼓楼北街3号院,地铁：距昌平线昌平站800米
1702,2790,11,48547-B,2室1卫,2/5层,丰台区,纪家庙,郑王坟141号院,地铁：距10号线纪家庙站750米
1703,2890,13,50265-C,3室1卫,12/22层,丰台区,泥洼,盛鑫嘉园,地铁：距10号线泥洼站50米
1704,3040,9,51878-C,4室1卫,16/28层,朝阳区,望京,望京西园一区,"地铁：距14号线东段,15号线望京站850米"
1705,2040,11,60942-B,3室1卫,14/26层,通州区,果园,通广嘉园,地铁：距八通线果园站1450米
1706,2400,9,61693-B,3室1卫,13/16层,丰台区,菜户营,鹏润家园,地铁：距7号线广安门内站2400米
1707,2580,12,6318-D,4室1卫,15/19层,朝阳区,成寿寺,静馨嘉苑,地铁：距10号线成寿寺站400米
1708,2560,12,67404-B,3室1卫,21/28层,通州区,物资学院路,新建村二期,地铁：距6号线物资学院路站550米
1709,4860,27,69886-A,1室1卫,8/23层,丰台区,蒲黄榆,gogo新世代,"地铁：距5号线,14号线东段蒲黄榆站100米"
1710,1750,12,73622-B,3室1卫,1/6层,通州区,万盛东,群芳三园,地铁：距7号线万盛东站1100米
1711,2900,15,75324-D,4室1卫,3/6层,丰台区,科怡路,怡海花园恒丰园,地铁：距9号线科怡路站550米
1712,2080,11,79456-D,4室1卫,1/5层,大兴区,高米店南,兴涛社区,地铁：距4号线大兴线高米店南站600米
1713,3810,25,9584-B,4室1卫,7/11层,丰台区,角门西,瑞丽江畔,"地铁：距10号线,4号线大兴线角门西站350米"
1714,2390,9,9576-B,3室1卫,5/20层,朝阳区,成寿寺,方庄南路18号院,地铁：距10号线成寿寺站700米
1715,2100,8,121988-C,4室1卫,11/22层,朝阳区,双合,建工双合家园,地铁：距7号线双合站350米
1716,2640,15,1020-C,4室2卫,1/20层,昌平区,天通苑南,天通苑西一区,地铁：距5号线天通苑南站150米
1717,1400,10,125395-B,4室1卫,2/9层,房山区,良乡大学城北,金地朗悦悦园,地铁：距房山线良乡大学城北站950米
1718,1850,13,11042-A,4室1卫,1/6层,顺义区,石门,前进花园玉兰苑,地铁：距15号线石门站650米
1719,2950,21,138066-C,3室1卫,2/6层,丰台区,丰台站,汇丰家园,"地铁：距10号线,16号线丰台站站650米"
1720,3040,12,138811-A,3室1卫,20/22层,海淀区,永泰庄,清景园,地铁：距8号线永泰庄站850米
1721,2780,16,143810-C,4室1卫,5/8层,昌平区,天通苑,天通苑北一区,地铁：距5号线天通苑站350米
1722,3900,17,141834-A,3室1卫,4/6层,朝阳区,光熙门,西坝河北里,地铁：距13号线光熙门站500米
1723,2610,12,145138-B,2室1卫,3/6层,石景山区,古城,古城北路,地铁：距1号线古城站1150米
1724,2040,11,141105-C,3室1卫,13/16层,丰台区,东高地,益丰园,地铁：距8号线南段东高地站750米
1725,1670,14,140805-A,3室1卫,4/6层,通州区,通州北关,东潞苑,地铁：距6号线通州北关站2350米
1726,1900,9,149883-A,2室1卫,5/6层,通州区,北运河西,玉桥中路甲2号院,地铁：距6号线北运河西站850米
1727,8590,96,152158-A,2室1卫,27/30层,朝阳区,青年路,国美第一城3号院,地铁：距6号线青年路站1200米
1728,2320,14,153698-D,4室1卫,17/25层,石景山区,杨庄,海特花园小区,"地铁：距1号线,6号线苹果园站1400米"
1729,1740,12,153850-D,4室2卫,2/6层,顺义区,顺义,双兴南区,地铁：距15号线顺义站1000米
1730,1980,8,156972-B,3室1卫,17/18层,大兴区,荣昌东街,南海家园三里,地铁：距亦庄线荣昌东街站3150米
1731,2330,12,157760-C,3室1卫,17/25层,大兴区,西红门,鸿坤理想城八期,地铁：距4号线大兴线西红门站1250米
1732,3350,20,1598-E,5室1卫,8/28层,朝阳区,青年路,甘露家园,地铁：距6号线青年路站700米
1733,3650,12,16585-A,2室1卫,7/16层,西城区,车公庄西,扣钟北里,地铁：距6号线车公庄西站600米
1734,1660,9,18690-A,4室1卫,5/20层,昌平区,天通苑北,龙冠冠华苑一区,地铁：距5号线天通苑北站3950米
1735,2260,15,20943-B,3室1卫,4/11层,通州区,梨园,梨园新村,地铁：距八通线梨园站550米
1736,2540,16,21949-B,3室1卫,2/6层,朝阳区,常营,连心园西区,地铁：距6号线常营站800米
1737,7300,63,24643-A,2室1卫,5/6层,朝阳区,金台路,甜水园街,"地铁：距6号线,14号线东段金台路站500米"
1738,3860,28,2384-E,5室2卫,15/26层,朝阳区,黄渠,柏林爱乐二期,地铁：距6号线黄渠站850米
1739,2430,13,27975-B,3室1卫,1/14层,海淀区,北安河,安河家园四里,地铁：距16号线北安河站550米
1740,2480,16,25040-A,3室1卫,1/6层,朝阳区,常营,连心园西区,地铁：距6号线常营站800米
1741,1700,18,29375-C,4室1卫,7/21层,房山区,马各庄,中冶蓝城,地铁：距燕房线马各庄站500米
1742,1570,9,30798-C,3室1卫,4/6层,顺义区,顺义,双兴东区,地铁：距15号线顺义站900米
1743,1440,10,32545-A,4室1卫,5/6层,房山区,篱笆房,碧桂园温泉小区C区,地铁：距房山线篱笆房站1500米
1744,2070,16,32632-A,3室1卫,6/6层,顺义区,顺义,东兴一区,地铁：距15号线顺义站400米
1745,3040,14,33070-B,3室1卫,5/9层,朝阳区,双桥,金隅康惠园,地铁：距八通线双桥站600米
1746,1830,13,33303-A,2室1卫,6/6层,顺义区,石门,澜西园,地铁：距15号线石门站2200米
1747,1510,11,31449-C,5室1卫,14/15层,房山区,良乡大学城西,鸿顺园东区,地铁：距房山线良乡大学城西站350米
1748,2280,13,33601-C,3室1卫,5/6层,丰台区,丰台东大街,东安街头条,地铁：距9号线丰台东大街站1400米
1749,3570,23,35192-A,3室1卫,13/23层,海淀区,育新,上奥世纪,地铁：距8号线育新站1500米
1750,2230,9,34587-B,4室1卫,8/15层,海淀区,永丰,友谊嘉园三期,地铁：距16号线永丰站2150米
1751,3190,14,367-A,5室2卫,2/28层,朝阳区,关庄,嘉铭园B区,地铁：距15号线关庄站450米
1752,2730,10,3512-B,3室1卫,17/20层,朝阳区,北苑路北,来北家园,地铁：距5号线北苑路北站1350米
1753,1110,11,38482-A,3室1卫,5/6层,房山区,星城,燕化星城建德四里,地铁：距燕房线星城站300米
1754,2330,16,39016-A,2室1卫,11/11层,通州区,通州北关,苏坨新村,地铁：距6号线通州北关站2800米
1755,3040,9,3707-C,3室1卫,19/28层,朝阳区,劲松,华腾园,地铁：距10号线劲松站450米
1756,2860,17,40016-A,2室1卫,3/5层,朝阳区,传媒大学,电建北院,地铁：距八通线传媒大学站750米
1757,2200,11,3815-D,4室1卫,4/6层,朝阳区,双桥,双惠苑,地铁：距八通线双桥站500米
1758,2280,8,37204-C,3室1卫,4/15层,大兴区,万源街,鹿鸣苑,地铁：距亦庄线万源街站550米
1759,1480,9,41878-C,4室1卫,7/16层,顺义区,顺义,石园北区,地铁：距15号线顺义站1950米
1760,1960,8,43627-C,3室1卫,15/21层,昌平区,天通苑北,龙冠冠华苑四区,地铁：距5号线天通苑北站3750米
1761,2630,11,45436-A,3室1卫,4/6层,丰台区,纪家庙,万柳西园,地铁：距10号线纪家庙站850米
1762,3290,10,47456-A,5室1卫,1/5层,海淀区,西二旗,领秀新硅谷,"地铁：距13号线,昌平线西二旗站700米"
1763,4380,19,47863-A,2室1卫,3/18层,朝阳区,阜通,花家地北里,地铁：距14号线东段阜通站850米
1764,2630,11,50236-A,2室1卫,5/6层,西城区,陶然亭,右安门内西街甲10号院,地铁：距4号线大兴线陶然亭站1450米
1765,7060,59,51108-A,1室1卫,25/28层,朝阳区,望京,望京西园一区,"地铁：距14号线东段,15号线望京站850米"
1766,2160,16,52111-C,4室1卫,7/13层,顺义区,花梨坎,天裕昕园西区,地铁：距15号线花梨坎站2750米
1767,3070,10,52083-C,3室1卫,22/24层,朝阳区,劲松,农光里,地铁：距10号线劲松站350米
1768,1810,11,58055-C,3室1卫,12/18层,通州区,通运门,京贸家园,地铁：距6号线通运门站2650米
1769,5870,52,58244-A,1室1卫,1/6层,朝阳区,潘家园,华威西里,地铁：距10号线潘家园站650米
1770,1830,10,59105-A,3室1卫,5/6层,通州区,通运门,新华东街,地铁：距6号线通运门站950米
1771,2630,11,59416-A,3室1卫,4/6层,通州区,物资学院路,新建村小区,地铁：距6号线物资学院路站550米
1772,2440,13,5982-A,3室1卫,3/6层,朝阳区,星火,姚家园西里5号院,"地铁：距3号线,20号线星火站600米"
