,价格,面积,编号,户型,楼层,位置1,位置2,小区,地铁
4858,3330.0,13.0,133982-C,4室1卫,11/24层,朝阳区,望京,望京新城,"地铁：距14号线东段,15号线望京站300米"
4859,2260.0,9.0,136179-A,2室1卫,3/6层,朝阳区,八里桥,八里桥南院,地铁：距八通线八里桥站350米
4860,2190.0,10.0,136266-A,2室1卫,5/25层,大兴区,生物医药基地,龙湖时代天街,地铁：距4号线大兴线生物医药基地站150米
4861,1350.0,10.0,136911-A,3室1卫,2/11层,房山区,良乡大学城,东羊庄新村,地铁：距房山线良乡大学城站1200米
4862,2880.0,11.0,137089-A,2室1卫,2/6层,西城区,天桥,南纬路2号院,地铁：距8号线南段天桥站450米
4863,2550.0,8.0,138075-B,2室1卫,8/15层,通州区,物资学院路,永顺家园,地铁：距6号线物资学院路站700米
4864,3000.0,18.0,139583-B,3室1卫,19/24层,丰台区,丰台东大街,庄维多摩市三期,地铁：距9号线丰台东大街站600米
4865,2960.0,16.0,139583-C,3室1卫,19/24层,丰台区,丰台东大街,庄维多摩市三期,地铁：距9号线丰台东大街站600米
4866,1860.0,12.0,138953-C,3室1卫,4/6层,通州区,梨园,梨园镇政府家属楼,地铁：距八通线梨园站500米
4867,1990.0,9.0,12795-B,4室1卫,4/18层,朝阳区,管庄,京通苑阳光华苑,地铁：距八通线管庄站500米
4868,2630.0,8.0,11902-D,4室1卫,7/16层,朝阳区,立水桥,世华泊郡,"地铁：距13号线,5号线立水桥站1050米"
4869,2990.0,16.0,145620-A,3室1卫,11/16层,大兴区,枣园,彩虹新城,地铁：距4号线大兴线枣园站650米
4870,3410.0,18.0,145637-A,2室1卫,2/8层,昌平区,天通苑,天通苑北三区,地铁：距5号线天通苑站1700米
4871,2690.0,10.0,145523-A,3室1卫,9/18层,丰台区,刘家窑,福臻家园,"地铁：距5号线,10号线,亦庄线宋家庄站1000米"
4872,2780.0,12.0,12884-A,3室1卫,2/6层,朝阳区,立水桥南,大羊坊8号院,地铁：距5号线立水桥南站400米
4873,2550.0,12.0,146347-C,3室1卫,2/18层,通州区,果园,世纪星城,地铁：距八通线果园站950米
4874,1790.0,16.0,147009-B,3室1卫,6/7层,昌平区,昌平,东关北里小区,地铁：距昌平线昌平站1000米
4875,2550.0,16.0,146339-B,2室1卫,1/6层,通州区,通州北苑,通惠北路小区,地铁：距八通线通州北苑站1300米
4876,2430.0,7.0,13171-D,4室1卫,2/18层,昌平区,回龙观东大街,首开国风美唐三期,地铁：距8号线回龙观东大街站500米
4877,2120.0,10.0,149240-B,2室1卫,6/11层,房山区,稻田,长景新园,地铁：距房山线稻田站350米
4878,2580.0,16.0,13413-A,3室1卫,4/6层,朝阳区,常营,连心园西区,地铁：距6号线常营站800米
4879,2380.0,11.0,150165-B,3室1卫,1/11层,昌平区,回龙观东大街,紫金新干线二期,地铁：距8号线回龙观东大街站1400米
4880,3330.0,10.0,13453-B,3室1卫,18/28层,海淀区,六道口,双清路2号院,地铁：距15号线六道口站1800米
4881,1720.0,8.0,147847-A,3室1卫,4/6层,大兴区,黄村火车站,车站中里,地铁：距4号线大兴线黄村火车站站250米
4882,2910.0,9.0,13619-C,3室1卫,8/10层,海淀区,清河,裕和嘉园,地铁：距13号线清河站1350米
4883,2530.0,15.0,147560-B,2室1卫,4/5层,石景山区,古城,十万坪,地铁：距1号线古城站600米
4884,7760.0,83.0,151509-A,2室1卫,3/27层,朝阳区,十里堡,晨光家园,地铁：距6号线十里堡站550米
4885,5210.0,17.0,151956-A,3室1卫,20/32层,朝阳区,大望路,soho现代城,"地铁：距1号线,14号线东段大望路站250米"
4886,2100.0,8.0,152291-B,2室1卫,2/6层,大兴区,旧宫,清欣园,地铁：距亦庄线旧宫站1650米
4887,2520.0,15.0,152316-A,2室1卫,17/24层,通州区,通州北关,碧水明珠,地铁：距6号线通州北关站850米
4888,2880.0,11.0,151638-B,2室1卫,16/17层,朝阳区,成寿寺,方庄南路18号院,地铁：距10号线成寿寺站700米
4889,3030.0,14.0,153189-B,3室1卫,3/6层,海淀区,农大南路,万树园,地铁：距16号线农大南路站850米
4890,3410.0,12.0,153226-B,2室1卫,3/18层,海淀区,花园桥,紫竹院小区,地铁：距6号线花园桥站1150米
4891,3890.0,18.0,153302-B,3室1卫,2/20层,丰台区,马家堡,玺萌丽苑,地铁：距4号线大兴线马家堡站650米
4892,2130.0,8.0,153346-A,4室1卫,14/27层,朝阳区,管庄,东卫城,地铁：距八通线管庄站400米
4893,3160.0,9.0,154512-B,2室1卫,5/6层,海淀区,海淀五路居,西木小区,地铁：距6号线海淀五路居站350米
4894,3450.0,11.0,153976-B,3室1卫,18/20层,朝阳区,光熙门,西坝河北里,地铁：距13号线光熙门站500米
4895,1960.0,10.0,155113-A,2室1卫,1/5层,顺义区,顺义,建新北区,地铁：距15号线顺义站700米
4896,1940.0,14.0,155113-B,2室1卫,1/5层,顺义区,顺义,建新北区,地铁：距15号线顺义站700米
4897,6540.0,49.0,155060-A,1室1卫,5/15层,朝阳区,呼家楼,向军北里,"地铁：距6号线,10号线呼家楼站250米"
4898,3240.0,9.0,155677-B,2室1卫,1/11层,昌平区,回龙观,新龙城二期,地铁：距13号线回龙观站250米
4899,2710.0,10.0,155613-B,2室1卫,22/25层,石景山区,金安桥,金铸阳光苑,"地铁：距6号线,S1线金安桥站500米"
4900,1790.0,10.0,156099-C,3室1卫,1/6层,大兴区,黄村火车站,车站中里,地铁：距4号线大兴线黄村火车站站250米
4901,2320.0,18.0,156239-C,3室1卫,1/6层,通州区,同济南路,神龙金桥,地铁：距亦庄线同济南路站2650米
4902,2480.0,9.0,14293-A,3室1卫,10/12层,朝阳区,潘家园,潘家园小区,地铁：距10号线潘家园站1000米
4903,2020.0,11.0,156990-D,4室2卫,8/29层,大兴区,天宫院,保利春天里二区,地铁：距4号线大兴线天宫院站150米
4904,3810.0,15.0,156779-A,2室1卫,3/6层,朝阳区,柳芳,和平街十四区,地铁：距13号线柳芳站450米
4905,2570.0,10.0,157153-C,3室1卫,5/6层,丰台区,北京南站,洋桥北里,"地铁：距4号线大兴线,14号线东段北京南站站300米"
4906,2270.0,11.0,13055-B,3室1卫,6/6层,丰台区,公益西桥,富卓苑,地铁：距4号线大兴线公益西桥站550米
4907,1850.0,8.0,14628-D,4室1卫,19/24层,朝阳区,管庄,管庄西里,地铁：距八通线管庄站1050米
4908,1400.0,8.0,14573-C,3室1卫,6/6层,顺义区,石门,怡馨家园,地铁：距15号线石门站1250米
4909,6250.0,56.0,14699-A,1室1卫,6/25层,东城区,广渠门内,水上华城,地铁：距7号线广渠门内站850米
4910,2780.0,12.0,10754-A,4室1卫,3/5层,昌平区,回龙观,新龙城三区,地铁：距13号线回龙观站450米
4911,2730.0,9.0,13188-B,4室1卫,15/18层,海淀区,清河,安宁佳园,"地铁：距13号线,昌平线西二旗站1850米"
4912,2170.0,13.0,15408-A,3室1卫,9/11层,顺义区,国展,翠竹新村,地铁：距15号线国展站1800米
4913,2190.0,14.0,15818-C,3室1卫,1/11层,顺义区,国展,翠竹新村,地铁：距15号线国展站1800米
4914,2940.0,11.0,1570-B,3室1卫,5/6层,朝阳区,劲松,劲松三区,地铁：距10号线劲松站300米
4915,2630.0,17.0,14558-C,3室1卫,6/6层,朝阳区,常营,连心园西区,地铁：距6号线常营站800米
4916,6570.0,53.0,15993-A,1室1卫,10/17层,海淀区,慈寿寺,北洼西里,"地铁：距6号线,10号线慈寿寺站850米"
4917,1830.0,10.0,16363-B,4室1卫,8/12层,顺义区,国展,翠竹新村,地铁：距15号线国展站1800米
4918,1930.0,16.0,16902-C,4室1卫,4/6层,通州区,次渠,次渠怡芳园小区,"地铁：距亦庄线,17号线次渠站600米"
4919,3110.0,20.0,1692-B,3室1卫,8/32层,朝阳区,北苑,广华居,地铁：距13号线北苑站1100米
4920,2710.0,11.0,1661-A,3室1卫,17/28层,朝阳区,高碑店,兴隆家园,地铁：距八通线高碑店站600米
4921,2900.0,7.0,1687-C,3室1卫,2/6层,朝阳区,东湖渠,利泽西园,地铁：距14号线东段东湖渠站200米
4922,1590.0,8.0,17803-B,4室1卫,10/20层,通州区,通州北关,中国铁建通瑞嘉苑,地铁：距6号线通州北关站2900米
4923,1440.0,7.0,18462-A,3室1卫,1/6层,顺义区,顺义,裕龙四区,地铁：距15号线顺义站1550米
4924,3310.0,10.0,13961-B,3室1卫,4/10层,海淀区,清河,裕和嘉园,地铁：距13号线清河站1350米
4925,1490.0,7.0,18523-B,4室1卫,2/20层,顺义区,顺义,幸福东区,地铁：距15号线顺义站350米
4926,3950.0,65.0,18518-A,1室1卫,8/18层,大兴区,瀛海,南海家园二里,地铁：距亦庄线荣昌东街站3500米
4927,1460.0,9.0,18529-C,4室1卫,4/6层,顺义区,顺义,双兴北区,地铁：距15号线顺义站1250米
4928,2830.0,24.0,19175-B,3室1卫,6/6层,朝阳区,草房,连心园东区,地铁：距6号线草房站500米
4929,1930.0,9.0,19177-C,3室1卫,1/16层,顺义区,花梨坎,枫泉花园,地铁：距15号线花梨坎站700米
4930,1990.0,9.0,17654-C,3室1卫,13/16层,顺义区,花梨坎,枫泉花园,地铁：距15号线花梨坎站700米
4931,2200.0,8.0,19303-B,3室1卫,16/18层,朝阳区,草房,保利嘉园1号院,地铁：距6号线草房站950米
4932,2240.0,11.0,19387-A,3室1卫,3/21层,丰台区,樊羊路,花香东苑,地铁：距房山线樊羊路站450米
4933,2430.0,11.0,19547-C,3室1卫,11/29层,朝阳区,北岗子,恒大江湾,"地铁：距12号线,平谷线北岗子站800米"
4934,5600.0,39.0,20085-A,1室1卫,3/6层,朝阳区,劲松,劲松四区,地铁：距10号线劲松站650米
4935,1520.0,11.0,20299-B,4室1卫,5/5层,通州区,通州北关,刘庄新村,地铁：距6号线通州北关站2700米
4936,2630.0,17.0,20897-C,3室1卫,5/6层,朝阳区,常营,连心园西区,地铁：距6号线常营站800米
4937,1820.0,7.0,20616-C,3室1卫,14/18层,朝阳区,东坝中街,北京城建福润四季,地铁：距3号线东坝中街站2800米
4938,2460.0,11.0,21918-C,3室1卫,7/19层,朝阳区,星火,姚家园东里8号院,"地铁：距3号线,20号线星火站800米"
4939,1240.0,13.0,21603-B,4室1卫,6/6层,房山区,良乡大学城西,东关家园,地铁：距房山线良乡大学城西站1050米
4940,1760.0,10.0,22611-C,4室1卫,1/6层,通州区,北运河西,乔庄西区,地铁：距6号线北运河西站1000米
4941,2640.0,13.0,20806-D,4室1卫,21/21层,丰台区,樊羊路,花香东苑,地铁：距房山线樊羊路站450米
4942,2850.0,8.0,24046-C,3室1卫,8/28层,海淀区,西二旗,回龙观新村中区,"地铁：距13号线,昌平线西二旗站1100米"
4943,1600.0,11.0,21905-C,4室1卫,3/18层,顺义区,顺义,石园北区,地铁：距15号线顺义站1950米
4944,2810.0,13.0,15020-A,3室1卫,5/22层,丰台区,角门东,金胜嘉谊家园,地铁：距10号线角门东站700米
4945,1420.0,7.0,23811-C,3室1卫,7/24层,房山区,良乡大学城,首创紫悦台,地铁：距房山线良乡大学城站550米
4946,2820.0,16.0,24374-B,3室1卫,5/6层,朝阳区,草房,连心园东区,地铁：距6号线草房站500米
4947,1920.0,9.0,20377-C,4室1卫,5/18层,顺义区,顺义,金汉绿港三区,地铁：距15号线顺义站650米
4948,2070.0,8.0,24457-B,4室1卫,2/22层,朝阳区,双合,建工双合家园,地铁：距7号线双合站350米
4949,2480.0,14.0,2365-B,4室1卫,6/17层,丰台区,新宫,德鑫嘉园三期,"地铁：距4号线大兴线,19号线新宫站850米"
4950,2830.0,14.0,24201-A,2室1卫,3/5层,朝阳区,褡裢坡,金星小区,地铁：距6号线褡裢坡站950米
4951,1080.0,9.0,24806-C,4室1卫,3/5层,房山区,阎村,绿城百合公寓栖霞苑,地铁：距燕房线阎村站950米
4952,1760.0,10.0,24931-C,5室2卫,6/6层,通州区,万盛东,绣江南,地铁：距7号线万盛东站350米
4953,2890.0,21.0,22763-F,7室1卫,7/8层,朝阳区,双桥,水郡长安,地铁：距八通线双桥站800米
4954,2370.0,18.0,25279-A,3室1卫,5/6层,通州区,通运门,同心嘉园,地铁：距6号线通运门站400米
4955,2240.0,17.0,25479-C,3室1卫,4/6层,通州区,通州北关,西潞苑小区,地铁：距6号线通州北关站1950米
4956,2390.0,14.0,1118-A,3室1卫,4/18层,朝阳区,管庄,管庄新村,地铁：距八通线管庄站600米
4957,2160.0,13.0,286-C,4室2卫,3/18层,通州区,果园,世纪星城,地铁：距八通线果园站950米
4958,2410.0,14.0,26567-C,3室1卫,1/27层,朝阳区,小红门,鸿博家园二期F区,地铁：距亦庄线小红门站550米
4959,1930.0,7.0,27620-B,4室1卫,5/29层,朝阳区,北岗子,恒大华府,"地铁：距12号线,平谷线北岗子站700米"
4960,2400.0,11.0,27620-D,4室1卫,5/29层,朝阳区,北岗子,恒大华府,"地铁：距12号线,平谷线北岗子站700米"
4961,2520.0,12.0,28012-A,3室1卫,16/21层,朝阳区,星火,姚家园东里8号院,"地铁：距3号线,20号线星火站800米"
4962,2930.0,16.0,28012-B,3室1卫,16/21层,朝阳区,星火,姚家园东里8号院,"地铁：距3号线,20号线星火站800米"
4963,1530.0,11.0,27870-A,4室1卫,13/13层,房山区,篱笆房,天资华府,地铁：距房山线篱笆房站1950米
4964,4770.0,24.0,28040-A,4室1卫,2/7层,海淀区,车道沟,远大园四区,地铁：距10号线车道沟站800米
4965,2020.0,15.0,27713-C,3室1卫,6/6层,通州区,万盛东,群芳三园,地铁：距7号线万盛东站1100米
4966,2640.0,12.0,28308-C,5室1卫,3/8层,朝阳区,肖村,中海城圣朝菲,地铁：距亦庄线肖村站600米
4967,1910.0,11.0,28368-D,4室1卫,12/15层,通州区,高楼金,瑞都公园世家南区,地铁：距7号线高楼金站500米
4968,2690.0,16.0,27608-D,4室1卫,6/6层,通州区,通州北苑,新华西街55号院,地铁：距八通线通州北苑站900米
4969,2600.0,16.0,28995-A,3室1卫,20/27层,朝阳区,小红门,鸿博家园二期D区,地铁：距亦庄线小红门站450米
4970,1920.0,7.0,28995-B,3室1卫,20/27层,朝阳区,小红门,鸿博家园二期D区,地铁：距亦庄线小红门站450米
4971,1320.0,7.0,29104-A,4室1卫,2/6层,通州区,通州北关,刘庄新村,地铁：距6号线通州北关站2700米
4972,2180.0,15.0,29673-C,4室1卫,4/18层,通州区,高楼金,瑞都公园世家南区,地铁：距7号线高楼金站500米
4973,1990.0,6.0,29005-C,4室1卫,2/30层,朝阳区,东坝中街,金隅悦和园,地铁：距14号线东段将台站4400米
4974,2020.0,10.0,30697-B,2室1卫,5/15层,朝阳区,东坝中街,金驹家园,地铁：距6号线褡裢坡站4200米
4975,1830.0,7.0,29071-D,4室1卫,1/9层,顺义区,花梨坎,吉祥花园,地铁：距15号线花梨坎站450米
4976,8240.0,63.0,148157-A,1室1卫,5/27层,东城区,广渠门外,金桥国际,"地铁：距7号线,17号线广渠门外站650米"
4977,7760.0,63.0,152012-A,1室1卫,5/25层,东城区,广渠门外,金桥国际,"地铁：距7号线,17号线广渠门外站650米"
4978,7190.0,64.0,15201-A,1室1卫,20/23层,朝阳区,双井,非常生活,"地铁：距7号线,10号线双井站600米"
4979,1870.0,10.0,3460-G,7室2卫,6/7层,朝阳区,星火,姚家园西里5号院,"地铁：距3号线,20号线星火站600米"
4980,2610.0,10.0,2071-C,3室1卫,22/28层,朝阳区,劲松,华腾园,地铁：距10号线劲松站450米
4981,1760.0,11.0,11021-D,4室1卫,6/6层,通州区,土桥,迎喜家园,地铁：距八通线土桥站400米
4982,2000.0,13.0,4726-F,7室2卫,6/6层,朝阳区,星火,姚家园西里5号院,"地铁：距3号线,20号线星火站600米"
4983,6220.0,52.0,70990-A,1室1卫,11/16层,西城区,广安门内,广益大厦,地铁：距7号线广安门内站250米
4984,1720.0,11.0,221-D,4室2卫,6/6层,通州区,通州北苑,杨庄小区,地铁：距八通线通州北苑站400米
4985,2260.0,10.0,137880-B,2室1卫,11/12层,朝阳区,传媒大学,定福庄南里1号院,地铁：距八通线传媒大学站850米
4986,5940.0,49.0,50286-A,1室1卫,9/24层,朝阳区,劲松,都城心屿,地铁：距10号线劲松站850米
4987,2000.0,10.0,139377-C,3室1卫,3/6层,朝阳区,孙河,康营小区A区,地铁：距15号线孙河站1650米
4988,2210.0,9.0,79232-B,4室1卫,3/9层,丰台区,郭庄子,建邦枫景,地铁：距14号线西段郭庄子站400米
4989,2200.0,11.0,29953-C,3室1卫,1/6层,朝阳区,孙河,康营家园F区,地铁：距15号线孙河站1150米
4990,1880.0,11.0,39174-B,3室2卫,12/12层,通州区,通运门,芙蓉园,地铁：距6号线通运门站2150米
4991,2240.0,10.0,5616-D,5室1卫,6/6层,朝阳区,青年路,雅成一里,地铁：距6号线青年路站550米
4992,1580.0,13.0,30992-A,4室1卫,2/17层,房山区,良乡大学城北,智汇雅苑,地铁：距房山线良乡大学城北站450米
4993,4410.0,61.0,147376-A,1室1卫,9/18层,朝阳区,肖村,庑殿家苑B区,地铁：距亦庄线肖村站1950米
4994,1570.0,13.0,28371-D,5室1卫,3/6层,顺义区,顺义,双兴南区,地铁：距15号线顺义站1000米
4995,2680.0,14.0,42131-B,3室1卫,3/6层,朝阳区,黄渠,常营民族家园三期,地铁：距6号线黄渠站200米
4996,6710.0,42.0,59086-A,1室1卫,5/6层,朝阳区,三元桥,静安东里,"地铁：距10号线,12号线,机场线三元桥站550米"
4997,2150.0,10.0,9018-B,4室1卫,16/28层,朝阳区,草房,保利嘉园1号院,地铁：距6号线草房站950米
4998,5070.0,46.0,67595-A,1室1卫,1/27层,朝阳区,常营,北辰福第中区,地铁：距6号线常营站450米
4999,2450.0,10.0,18617-C,4室1卫,4/22层,丰台区,角门东,金胜嘉谊家园,地铁：距10号线角门东站700米
5000,1650.0,9.0,32173-B,3室1卫,20/27层,通州区,高楼金,新城乐居,地铁：距7号线高楼金站450米
5001,1640.0,10.0,66326-A,3室1卫,2/6层,昌平区,昌平,石坊院,地铁：距昌平线昌平站600米
5002,2230.0,15.0,210-D,4室2卫,24/24层,通州区,通州北苑,通典铭居,地铁：距八通线通州北苑站450米
5003,4700.0,50.0,23728-A,1室1卫,6/6层,朝阳区,管庄,双会小区,地铁：距八通线管庄站50米
5004,3070.0,9.0,65840-B,3室1卫,12/14层,朝阳区,阜通,都市心海岸,地铁：距14号线东段阜通站450米
5005,1250.0,11.0,25852-D,4室1卫,1/6层,房山区,苏庄,佳世苑小区,地铁：距房山线苏庄站650米
5006,5020.0,56.0,37872-A,1室1卫,3/23层,丰台区,海户屯,珠江骏景南区,地铁：距8号线南段海户屯站400米
5007,3950.0,44.0,42614-A,1室1卫,3/6层,通州区,通运门,皓月苑,地铁：距6号线通运门站750米
5008,1510.0,18.0,80638-C,3室1卫,5/6层,房山区,良乡大学城西,玉竹园,地铁：距房山线良乡大学城西站400米
5009,2510.0,10.0,7309-C,5室1卫,15/27层,朝阳区,立水桥,世华泊郡,"地铁：距13号线,5号线立水桥站1050米"
5010,2260.0,8.0,133195-B,3室1卫,7/24层,丰台区,角门东,东丽温泉,地铁：距10号线角门东站1050米
5011,2710.0,12.0,21401-C,3室1卫,21/24层,丰台区,刘家窑,正邦嘉园,地铁：距5号线刘家窑站300米
5012,1790.0,9.0,25704-B,3室1卫,4/6层,通州区,果园,复兴北里,地铁：距八通线果园站600米
5013,4910.0,58.0,139387-A,1室1卫,5/7层,大兴区,亦庄文化园,听涛雅苑,地铁：距亦庄线亦庄文化园站950米
5014,2160.0,14.0,46775-A,5室2卫,4/4层,大兴区,西红门,九龙家园南区,地铁：距4号线大兴线西红门站1600米
5015,2130.0,15.0,46775-E,5室2卫,4/4层,大兴区,西红门,九龙家园南区,地铁：距4号线大兴线西红门站1600米
5016,3030.0,11.0,11387-C,3室1卫,6/6层,朝阳区,和平西桥,胜古南里,地铁：距5号线和平西桥站450米
5017,1660.0,11.0,12028-A,3室1卫,19/25层,通州区,土桥,金隅通和园,地铁：距八通线土桥站1550米
5018,2670.0,8.0,141810-C,3室1卫,5/6层,朝阳区,金台夕照,呼家楼新街大院,地铁：距10号线金台夕照站600米
5019,2550.0,11.0,1441-B,3室1卫,4/18层,朝阳区,成寿寺,金第润苑,地铁：距10号线成寿寺站600米
5020,1630.0,10.0,219-B,3室1卫,6/6层,通州区,九棵树,葛布店南里,地铁：距八通线九棵树站300米
5021,2020.0,11.0,46775-C,5室2卫,4/4层,大兴区,西红门,九龙家园南区,地铁：距4号线大兴线西红门站1600米
5022,2840.0,21.0,48868-C,3室1卫,3/16层,石景山区,古城,古城南里,地铁：距1号线古城站100米
5023,2820.0,9.0,141810-B,3室1卫,5/6层,朝阳区,金台夕照,呼家楼新街大院,地铁：距10号线金台夕照站600米
5024,3750.0,52.0,149131-A,1室1卫,5/6层,通州区,梨园,葛布店东里,地铁：距八通线梨园站700米
5025,3420.0,9.0,20923-A,2室1卫,7/10层,西城区,长椿街,宣武门西大街小区,地铁：距2号线长椿街站150米
5026,1960.0,7.0,123565-C,3室1卫,1/6层,石景山区,八角游乐园,老山西里,地铁：距1号线八角游乐园站500米
5027,2080.0,14.0,16266-D,6室2卫,6/6层,丰台区,新宫,德鑫嘉园一期,"地铁：距4号线大兴线,19号线新宫站750米"
5028,5950.0,58.0,26495-A,1室1卫,8/17层,西城区,达官营,小马厂东里,"地铁：距7号线,16号线达官营站900米"
5029,1750.0,11.0,14304-A,3室1卫,4/20层,通州区,北运河东,荔景园新区,地铁：距6号线北运河东站1050米
5030,6860.0,45.0,140092-A,1室1卫,2/14层,朝阳区,团结湖,农展南里,"地铁：距3号线,10号线团结湖站250米"
5031,2460.0,12.0,147639-C,3室1卫,14/24层,丰台区,科怡路,南极星,地铁：距9号线科怡路站650米
5032,2270.0,12.0,49426-C,3室1卫,3/6层,石景山区,古城,八角南路,地铁：距1号线古城站350米
5033,2810.0,13.0,40858-C,3室1卫,19/29层,朝阳区,青年路,金隅泰和园,地铁：距6号线青年路站1250米
5034,2630.0,14.0,77080-A,3室1卫,14/18层,石景山区,西黄村,雍景四季,"地铁：距1号线,6号线苹果园站2350米"
5035,2640.0,9.0,7821-B,4室1卫,19/22层,海淀区,西小口,莱圳家园,地铁：距8号线西小口站650米
5036,5460.0,71.0,10837-A,2室1卫,6/6层,丰台区,大红门,建欣苑四里,"地铁：距8号线南段,10号线大红门站550米"
5037,2270.0,9.0,26234-C,3室1卫,4/29层,朝阳区,北岗子,恒大华府,"地铁：距12号线,平谷线北岗子站700米"
5038,2380.0,11.0,29860-C,3室1卫,14/19层,石景山区,八角游乐园,八角中里,地铁：距1号线八角游乐园站900米
5039,2480.0,17.0,34093-A,4室1卫,1/9层,顺义区,花梨坎,吉祥花园,地铁：距15号线花梨坎站450米
5040,4790.0,57.0,45468-A,1室1卫,21/28层,朝阳区,东坝中街,首开畅颐园,地铁：距14号线东段将台站3500米
5041,4040.0,21.0,7031-B,2室1卫,4/5层,朝阳区,金台夕照,呼家楼西里,地铁：距10号线金台夕照站550米
5042,2110.0,10.0,7300-A,4室1卫,6/6层,丰台区,木樨园,东木樨园小区,地铁：距8号线南段木樨园站550米
5043,2210.0,11.0,7828-C,3室1卫,2/20层,朝阳区,双桥,金隅康惠园,地铁：距八通线双桥站600米
5044,3850.0,19.0,124748-C,3室1卫,6/6层,东城区,雍和宫,和平里东街9号院,"地铁：距2号线,5号线雍和宫站800米"
5045,2950.0,15.0,14758-C,4室1卫,1/21层,朝阳区,金台路,甜水园北里,"地铁：距6号线,14号线东段金台路站650米"
5046,2370.0,7.0,50811-D,4室1卫,14/28层,海淀区,育新,龙旗广场,地铁：距8号线育新站700米
5047,2400.0,14.0,70879-B,3室1卫,4/11层,朝阳区,孙河,康营小区17区,地铁：距15号线孙河站1450米
5048,1630.0,11.0,77708-D,4室1卫,1/25层,门头沟区,桥户营,惠康嘉园二区,地铁：距S1线桥户营站850米
5049,3070.0,10.0,15872-A,2室1卫,4/6层,朝阳区,红庙,延静里中街,"地铁：距6号线,14号线东段金台路站800米"
5050,2210.0,12.0,46827-A,4室1卫,5/7层,朝阳区,星火,姚家园西里5号院,"地铁：距3号线,20号线星火站600米"
5051,2770.0,8.0,7037-A,4室1卫,9/20层,朝阳区,望京,南湖中园小区,"地铁：距14号线东段,15号线望京站700米"
5052,1420.0,11.0,47826-A,6室2卫,5/7层,通州区,通运门,新潮嘉园二期,地铁：距6号线通运门站4150米
5053,2890.0,19.0,58726-A,2室1卫,3/6层,石景山区,八宝山,永乐西区,地铁：距1号线八宝山站1000米
5054,2530.0,13.0,136162-B,2室1卫,4/5层,朝阳区,双桥,东柳西里,地铁：距八通线双桥站900米
5055,6480.0,49.0,145884-A,1室1卫,10/22层,朝阳区,将台,晶都国际,地铁：距14号线东段将台站550米
5056,2750.0,8.0,35189-B,3室1卫,22/29层,海淀区,莲花桥,盛今佳园,地铁：距10号线莲花桥站400米
5057,1910.0,9.0,38136-C,4室1卫,1/6层,大兴区,旧宫,清逸西园,地铁：距亦庄线旧宫站1550米
5058,3790.0,21.0,47402-C,4室1卫,13/13层,朝阳区,北苑,北苑家园清友园,地铁：距13号线北苑站550米
5059,2260.0,9.0,11993-A,3室1卫,11/11层,朝阳区,黄渠,苹果派,地铁：距6号线黄渠站650米
5060,2200.0,9.0,1541-B,3室1卫,7/22层,朝阳区,褡裢坡,定福庄北里1号院,地铁：距6号线褡裢坡站550米
5061,2490.0,17.0,2911-F,6室2卫,6/6层,朝阳区,星火,姚家园西里5号院,"地铁：距3号线,20号线星火站600米"
5062,2310.0,12.0,5137-C,3室1卫,1/6层,丰台区,大红门,苗圃东里,"地铁：距8号线南段,10号线大红门站250米"
5063,1600.0,11.0,58638-C,3室1卫,2/6层,顺义区,顺义,龙府花园,地铁：距15号线顺义站1400米
5064,1960.0,8.0,118949-A,2室1卫,4/6层,通州区,通州北苑,杨庄路63号院,地铁：距八通线通州北苑站500米
5065,3610.0,20.0,119320-A,2室1卫,4/7层,朝阳区,金台路,道家园,"地铁：距6号线,14号线东段金台路站700米"
5066,3090.0,19.0,122562-B,2室1卫,4/18层,西城区,达官营,小红庙南里,"地铁：距7号线,16号线达官营站1150米"
5067,2410.0,10.0,135370-B,3室1卫,8/13层,朝阳区,褡裢坡,福盈家园1号院,地铁：距6号线褡裢坡站350米
5068,2530.0,10.0,143157-A,4室1卫,13/15层,朝阳区,立水桥,立城苑,"地铁：距13号线,5号线立水桥站300米"
5069,3360.0,13.0,254-C,4室2卫,1/26层,朝阳区,三元桥,国际港,"地铁：距10号线,12号线,机场线三元桥站300米"
5070,3300.0,19.0,46727-B,3室1卫,15/20层,丰台区,马家堡,未来明珠,地铁：距4号线大兴线马家堡站100米
5071,2530.0,14.0,8085-D,4室1卫,1/17层,朝阳区,立水桥南,溪城家园一号院,地铁：距5号线立水桥南站1100米
5072,2790.0,8.0,10033-C,3室1卫,3/5层,朝阳区,亮马桥,新源街,地铁：距10号线亮马桥站850米
